{"$schema":"http://json-schema.org/draft-07/schema#","description":"CubeLV Product Intelligence artifact contract V1 (AllTrue dogfood 2026-09-18). Knowledge/evidence handoff only; no runtime orchestration state.","required":["schema_version","run_id","project","generated_at","source_refs","signals","problem_clusters","proposal_cards","founder_decisions_required","rejected_items","already_solved_items","deferred_items","unknowns","recommended_next_pm_action","artifact_paths"],"title":"PRODUCT_INTELLIGENCE_RESULT V1","type":"object","properties":{"already_solved_items":{"items":{"type":"string"},"type":"array"},"artifact_paths":{"type":"object"},"deferred_items":{"items":{"type":"string"},"type":"array"},"founder_decisions_required":{"items":{"type":"string"},"type":"array"},"generated_at":{"type":"string"},"problem_clusters":{"items":{"required":["problem_id","title"],"type":"object","properties":{"problem_id":{"type":"string"},"title":{"type":"string"}}},"type":"array"},"project":{"type":"string"},"proposal_cards":{"items":{"required":["proposal_id","recommended_disposition"],"type":"object","properties":{"proposal_id":{"type":"string"},"recommended_disposition":{"enum":["READY_FOR_ENGINEERING_REVIEW","NEEDS_PRODUCT_EVIDENCE","NEEDS_FOUNDER_DECISION","MERGE_WITH_EXISTING","OPS_CHANGE_NOT_CODE","REJECT","ALREADY_SOLVED"],"type":"string"}}},"type":"array"},"recommended_next_pm_action":{"type":"string"},"rejected_items":{"items":{"type":"string"},"type":"array"},"result_file":{"type":"string"},"run_id":{"type":"string"},"schema_version":{"type":"string"},"signals":{"items":{"required":["signal_id"],"type":"object","properties":{"signal_id":{"type":"string"}}},"type":"array"},"source_refs":{"type":"object"},"status":{"type":"string"},"unknowns":{"items":{"type":"string"},"type":"array"}}}