{"artifact_paths":{"COMPETITOR_PATTERNS":"docs/product-intelligence/alltrue/2026-09-18-product-intelligence-v1/COMPETITOR_PATTERNS.md","CUBELV_RESPONSIBILITY_BOUNDARY":"docs/product-intelligence/alltrue/2026-09-18-product-intelligence-v1/CUBELV_RESPONSIBILITY_BOUNDARY.md","PROBLEM_CLUSTERS":"docs/product-intelligence/alltrue/2026-09-18-product-intelligence-v1/PROBLEM_CLUSTERS.md","PRODUCT_PROPOSALS":"docs/product-intelligence/alltrue/2026-09-18-product-intelligence-v1/PRODUCT_PROPOSALS.md","PRODUCT_SIGNAL_MAP":"docs/product-intelligence/alltrue/2026-09-18-product-intelligence-v1/PRODUCT_SIGNAL_MAP.md","RESULT":"docs/product-intelligence/alltrue/2026-09-18-product-intelligence-v1/PRODUCT_INTELLIGENCE_RESULT.json","SCHEMA":"docs/product-intelligence/alltrue/2026-09-18-product-intelligence-v1/PRODUCT_INTELLIGENCE_SCHEMA.json"},"already_solved_items":["TD-004–TD-011 swipe-card series (Done)","TD-062 calendar Phase 1–3+P4 (Done)","Admissions funnel live 2026-09-05 (sign-off pending)","#3052 LR ownership (#314)","#2715 LR fill/review tabs","in-app #295/#300/#311/#312 minor fixes"],"deferred_items":["RFC_BRANCH_HEALTH_V1 (Proposed)","RFC_LEARNING_ASSESSMENT_MVP (Slice 1)","RFC_COURSE_CONTINUITY (Draft)","RFC_SCHEDULE_OCCURRENCE_IDENTITY Phase 3 (gated)","RFID-1 #2981 Founder squash-merge"],"founder_decisions_required":["#2915/#2916 billing semantics + TD-068 statutory receipt (PROP-04 decision packet)","Course calendar Phase 1b/2/3 authorization (separate Plan review)","#3045 merge/activation cadence (PROP-01)","Lightweight wording sign-off for #2800/#2905/#2906 truth comments (PROP-06)"],"generated_at":"2026-09-18T00:00:00+08:00","problem_clusters":[{"problem_id":"PC-01","signals":["SIG-001","SIG-007","SIG-011"],"title":"Course editing lacks a unified surface (calendar + Course Manager integrating)"},{"problem_id":"PC-02","signals":["SIG-002","SIG-014"],"title":"Roster normalization debt (school-name variants; bounded typeahead relief)"},{"problem_id":"PC-03","signals":["SIG-008","SIG-005"],"title":"Fragile substitute/reschedule exception flow (two-step blind spot + cross-campus conflict)"},{"problem_id":"PC-04","signals":["SIG-009"],"title":"Attendance semantic confusion (presence vs attendance; swipe-write risk)"},{"problem_id":"PC-05","signals":["SIG-006"],"title":"Billing semantics at risk (reported vs received; statutory receipt debt)"},{"problem_id":"PC-06","signals":["SIG-013","SIG-004"],"title":"Learning-record workbench overload (three roles, one list; splitting in progress)"},{"problem_id":"PC-07","signals":["SIG-010"],"title":"Permission/identity boundary debt (multi-role + residual permissions)"},{"problem_id":"PC-08","signals":["SIG-011","SIG-012"],"title":"Product-ops meta debt (issue drift + PR evidence gaps)"}],"project":"alltrue","proposal_cards":[{"evidence":"#3045 open PR; #3040–#3044 merged; held by another worker","problem_id":"PC-01","project":"alltrue","proposal_id":"PROP-01","recommended_disposition":"NEEDS_FOUNDER_DECISION","title":"Course Manager follow-through (#3045 + enablement verification)"},{"evidence":"#3015 merged bounded typeahead; ClassDojo-analog funnel (secondary source)","problem_id":"PC-02","project":"alltrue","proposal_id":"PROP-02","recommended_disposition":"READY_FOR_ENGINEERING_REVIEW","title":"School directory intake funnel (search-first + alias table + review pool)"},{"evidence":"SUBSTITUTE_UX PRD/manual; SIG-005 probe shows opaque rules","problem_id":"PC-03","project":"alltrue","proposal_id":"PROP-03","recommended_disposition":"NEEDS_PRODUCT_EVIDENCE","title":"Atomic substitute flow (reschedule+substitute + conflict precheck)"},{"evidence":"RFC split Phase 1+2 on main; #2915/#2916 needs-decision; TD-068 blocked","problem_id":"PC-05","project":"alltrue","proposal_id":"PROP-04","recommended_disposition":"NEEDS_FOUNDER_DECISION","title":"Billing semantics decision packet (#2915/#2916 + receipt)"},{"evidence":"RFID policy locked; RFID-0 merged; #2981 pending; Procare/brightwheel layering (secondary)","problem_id":"PC-04","project":"alltrue","proposal_id":"PROP-05","recommended_disposition":"NEEDS_PRODUCT_EVIDENCE","title":"Two-layer attendance reconciliation (presence + classroom)"},{"evidence":"Truth-audit copy ready; only blocker is write permission (POST 403)","problem_id":"PC-08","project":"alltrue","proposal_id":"PROP-06","recommended_disposition":"OPS_CHANGE_NOT_CODE","title":"Issue truth fix batch (#2800/#2905/#2906 comments)"}],"recommended_next_pm_action":"Bounded PM Goal: PM_TRUTH_FIX_AND_EVIDENCE_BASELINE_V1 — (1) with write permission, post PROP-06 truth comments on #2800/#2905/#2906 (Founder wording sign-off); (2) instrument substitute-conflict rate + school-custom-input ratio + miss-swipe rate baselines for PROP-03/PROP-02/PROP-05; (3) draft PROP-04 billing DecisionPacket. No engineering dispatch; no Phase 1b/2/3; do not touch #3045/#3016/#2981 holders.","rejected_items":["Facial-recognition attendance","Per-feature permission matrix","Facility-dimension scheduling / camps-parties objects","Full school FK normalization + history rewrite","Fully automatic substitute matching"],"run_id":"2026-09-18-product-intelligence-v1","schema_version":"product-intelligence-result/v1","signals":[{"evidence_class":"USER_REPORTED","product_area":"scheduling","signal_id":"SIG-001","source_ref":"alltrue:bug_report:290 / GH #2800"},{"evidence_class":"USER_REPORTED","product_area":"students/admissions","signal_id":"SIG-002","source_ref":"in-app #296 / GH #2905"},{"evidence_class":"USER_REPORTED","product_area":"students","signal_id":"SIG-003","source_ref":"in-app #297 / GH #2906"},{"evidence_class":"USER_REPORTED","product_area":"learning records","signal_id":"SIG-004","source_ref":"in-app #314"},{"evidence_class":"OBSERVED","product_area":"cross-campus/scheduling","signal_id":"SIG-005","source_ref":"in-app #315"},{"evidence_class":"USER_REPORTED","product_area":"payment/tuition/receipts","signal_id":"SIG-006","source_ref":"RFC_REPORTED_PAID_ACCOUNTING_SPLIT; #2915/#2916"},{"evidence_class":"OBSERVED","product_area":"scheduling","signal_id":"SIG-007","source_ref":"MODULE_CALENDAR_SCHEDULE_UX.md; #1601/Epic #1600 (bodies UNOBSERVED)"},{"evidence_class":"OBSERVED","product_area":"leave/substitution","signal_id":"SIG-008","source_ref":"SUBSTITUTE_UX.md"},{"evidence_class":"USER_REPORTED","product_area":"attendance","signal_id":"SIG-009","source_ref":"GH #2809 / in-app #293; RFID-0 merged; #2981 open"},{"evidence_class":"INFERRED","product_area":"admin/permissions","signal_id":"SIG-010","source_ref":"PR #3016 open+dirty; #2970/#2972/#2942/#2959 (log messages only)"},{"evidence_class":"OBSERVED","product_area":"product-ops (meta)","signal_id":"SIG-011","source_ref":"GH #2800, #2905, #2906 (truth-reconciliation audit)"},{"evidence_class":"OBSERVED","product_area":"product-ops (meta)","signal_id":"SIG-012","source_ref":"17 open PRs, 9 missing Risk-Class/Tier"},{"evidence_class":"OBSERVED","product_area":"learning records","signal_id":"SIG-013","source_ref":"MODULE_LEARNING_RECORDS_UX.md; #1611 (cited in docs)"},{"evidence_class":"INFERRED","product_area":"admissions/onboarding","signal_id":"SIG-014","source_ref":"RFC_ADMISSIONS_FUNNEL_V1.md (runtime 2026-09-05; sign-off pending)"}],"source_refs":{"alltrue_system_main":"7ec7528a ops(in-app): #315 evidence probe + Phase-C expected-behavior closeout (#3055)","method":"CubeLV read-only bare-repo inspection; issue bodies/comments/CI/production UNOBSERVED","portfolio_ops_main":"5479119"},"status":"needs_founder_review","unknowns":["All frequencies / affected-user counts / revenue impact (UNKNOWN throughout)","GitHub issue live open/closed state + discussion content","CI/checks truth, deploy logs, production flag values, user verification","#2808/#2905/#2906/#2908/#2179 dedup status (needs Ubuntu-side recheck, F1)","In-app report originals/attachments","Billing semantics (#2915/#2916) domain inputs"]}